{
  "$schema": "https://json-schema.org/draft/2020-12/schema",
  "$id": "https://github.com/Viktorxyz/opencode-ship/schema/ship-config.schema.json",
  "title": "opencode-ship user config",
  "type": "object",
  "required": ["schemaVersion"],
  "additionalProperties": false,
  "properties": {
    "schemaVersion": { "enum": [1, 2] },
    "profile": {
      "type": "string",
      "enum": ["engineering", "core"],
      "description": "Active profile. Engineering is the only supported profile in 1.1.0; core is accepted on read for legacy consumer migration."
    },
    "owner": {
      "type": "string",
      "description": "Optional override for the issue/manifest owner field. Defaults to the agent's local user.name."
    },
    "project": {
      "type": "object",
      "additionalProperties": false,
      "properties": {
        "remote": { "type": "string", "minLength": 1 },
        "repository": { "type": "string", "pattern": "^[A-Za-z0-9_.-]+/[A-Za-z0-9_.-]+$" },
        "defaultBranch": { "type": "string", "minLength": 1 },
        "packageManager": { "enum": ["npm", "pnpm", "yarn", "bun"] },
        "detectOverrides": { "type": "boolean", "description": "Permit detection to refresh previously persisted values." }
      }
    },
    "delivery": {
      "type": "object",
      "additionalProperties": false,
      "properties": {
        "worktree": {
          "type": "object",
          "additionalProperties": false,
          "properties": {
            "root": { "type": "string", "minLength": 1 },
            "branchTemplate": { "type": "string", "minLength": 1 },
            "bootstrap": {
              "type": "array",
              "items": {
                "type": "array",
                "items": { "type": "string", "minLength": 1 },
                "minItems": 1
              }
            }
          }
        },
        "verification": {
          "type": "object",
          "additionalProperties": false,
          "properties": {
            "commands": {
              "type": "array",
              "minItems": 1,
              "items": {
                "type": "object",
                "required": ["id", "argv"],
                "additionalProperties": false,
                "properties": {
                  "id": { "type": "string", "minLength": 1 },
                  "argv": {
                    "type": "array",
                    "items": { "type": "string", "minLength": 1 },
                    "minItems": 1
                  },
                  "timeoutMs": { "type": "integer", "minimum": 1 }
                }
              }
            },
            "requireCleanDiffAfter": { "type": "boolean" },
            "invalidateOnHeadChange": { "type": "boolean" }
          }
        },
        "review": {
          "type": "object",
          "additionalProperties": false,
          "properties": {
            "agent": { "type": "string", "minLength": 1 },
            "required": { "type": "boolean" },
            "invalidateOnHeadChange": { "type": "boolean" }
          }
        },
        "ci": {
          "type": "object",
          "additionalProperties": false,
          "properties": {
            "driver": { "const": "github-status-checks" },
            "requiredChecks": {
              "type": "array",
              "items": { "type": "string", "minLength": 1 },
              "uniqueItems": true
            },
            "wait": { "type": "boolean" },
            "flakyRetry": { "type": "integer", "enum": [0, 1] }
          }
        },
        "ready": {
          "type": "object",
          "additionalProperties": false,
          "properties": {
            "requires": {
              "type": "array",
              "items": { "enum": ["review", "local-verification", "remote-ci"] },
              "uniqueItems": true
            },
            "stopAfterReady": { "type": "boolean" }
          }
        },
        "merge": {
          "type": "object",
          "additionalProperties": false,
          "properties": {
            "strategy": { "const": "squash" },
            "policy": { "const": "explicit-user-request-only" },
            "requireFreshGates": { "type": "boolean" }
          }
        },
        "cleanup": {
          "type": "object",
          "additionalProperties": false,
          "properties": {
            "when": { "const": "next-task" },
            "requireUnpublishedGuard": { "type": "boolean" }
          }
        }
      }
    },
    "tasks": {
      "type": "object",
      "description": "Optional override of the managed-file paths. Use only to relocate a target.",
      "additionalProperties": false,
      "properties": {
        "pluginPath": { "type": "string", "pattern": "^\\.opencode/.+\\.js$" },
        "agentsDir": { "type": "string", "pattern": "^\\.opencode/agents/?$" },
        "skillsDir": { "type": "string", "pattern": "^\\.opencode/skills/?$" }
      }
    },
    "workflow": {
      "type": "object",
      "description": "Workflow configuration. Models are optional at write time; the setup-ship-workflow skill fills them in. Once all three are present, ship-deliver can start.",
      "additionalProperties": false,
      "properties": {
        "models": {
          "type": "object",
          "additionalProperties": false,
          "description": "Optional model roles. All three roles must be present before ship-deliver can run.",
          "properties": {
            "planner": {
              "type": "string",
              "pattern": "^[A-Za-z0-9_.-]+/[A-Za-z0-9_.-]+$",
              "description": "Provider/model id for the strong planning child session."
            },
            "builder": {
              "type": "string",
              "pattern": "^[A-Za-z0-9_.-]+/[A-Za-z0-9_.-]+$",
              "description": "Provider/model id for the cheap builder child session."
            },
            "finalReviewer": {
              "type": "string",
              "pattern": "^[A-Za-z0-9_.-]+/[A-Za-z0-9_.-]+$",
              "description": "Provider/model id for the final Standards + Spec reviewers."
            }
          }
        },
        "approval": {
          "type": "object",
          "additionalProperties": false,
          "properties": {
            "mirrorToIssue": { "const": true },
            "maxFailedRounds": { "const": 3 }
          }
        }
      }
    }
  }
}
